{"expectedCostUSD":0.000203,"failureBoundHours":24.0,"failureBoundUSD":0.1464,"hardAdmissionCapUSD":0.15,"image":"python:3.11-slim","marginSha256":"f925f9f891e310d81ed0f7a775148dcf88a092506270bd9bd48bd6ee3aab971f","paidModelsInvoked":false,"pricingUSDPerHour":{"cpuPerCore":0.05,"diskPerGB":0.001,"memoryPerGB":0.01},"resources":{"cpu":0.1,"diskGB":0.1,"idleTimeoutSeconds":60.0,"memoryGB":0.1},"result":{"documentValid":true,"durationMs":39302,"imageCached":true,"marginVersion":"Margin 0.3.1","runtimeType":"prime"},"schema":"urn:marginbench:prime-runtime-probe:v1","status":"completed","wallet":{"afterBalanceUSD":199.9594,"beforeBalanceUSD":199.9594,"observedDebitUSD":0.0}}
